{
  "schemaVersion": "v0",
  "promptFamily": "tool_use_required",
  "selectedComponents": [
    {
      "componentId": "scaffold.system-rules",
      "action": "include",
      "path": "required_match",
      "reason": "omissionPolicy: never — always included",
      "tokensApprox": 350
    },
    {
      "componentId": "tool.read-file",
      "action": "include",
      "path": "required_match",
      "reason": "active tool match: tool.read-file is in activeToolIds and confirmed available in runtime",
      "tokensApprox": 120
    }
  ],
  "omittedComponents": [],
  "deferredComponents": [],
  "budgetPlan": {
    "totalPromptTokenTarget": 8000,
    "selectedTokensApprox": 470,
    "projectedOverflow": 0
  },
  "estimatedTokens": {
    "scaffold": 350,
    "skills": 0,
    "tools": 120,
    "history": 0,
    "total": 470
  },
  "riskFlags": [],
  "failOpenReasons": [],
  "planningWarnings": []
}
