{
  "schemaVersion": "v0",
  "promptFamily": "general_default",
  "selectedComponents": [
    {
      "componentId": "scaffold.system-rules",
      "action": "include",
      "path": "required_match",
      "reason": "omissionPolicy: never — always included; requiredWhen: * matched",
      "tokensApprox": 350
    }
  ],
  "omittedComponents": [
    {
      "componentId": "skill.heartbeat-proactive",
      "action": "omit",
      "path": "safe_to_omit_match",
      "reason": "safeToOmitWhen matched: general_default; Path A omission with positive evidence",
      "tokensApprox": 180
    }
  ],
  "deferredComponents": [
    {
      "componentId": "tool.unavailable-tool",
      "action": "defer",
      "path": "runtime_unavailable",
      "reason": "tool confirmed unavailable in capabilityInventory; capabilityInventoryComplete: true",
      "tokensApprox": 90
    }
  ],
  "budgetPlan": {
    "totalPromptTokenTarget": 8000,
    "selectedTokensApprox": 350,
    "projectedOverflow": 0
  },
  "estimatedTokens": {
    "scaffold": 350,
    "skills": 0,
    "tools": 0,
    "history": 0,
    "total": 350
  },
  "riskFlags": [],
  "failOpenReasons": [],
  "planningWarnings": [
    {
      "code": "active_id_unknown",
      "message": "activeSkillIds contains 'skill.does-not-exist-in-registry' which is not present in componentsById"
    }
  ]
}
