{
  "schemaVersion": "v0",
  "promptFamily": "general_default",
  "selectedComponents": [
    {
      "componentId": "scaffold.system-rules",
      "action": "include",
      "path": "required_match",
      "reason": "omissionPolicy: never — always included; requiredWhen: * matched",
      "tokensApprox": 350
    },
    {
      "componentId": "skill.general-assistant",
      "action": "include",
      "path": "default_include",
      "reason": "defaultAction: include; promptFamily general_default: no safeToOmitWhen matched",
      "tokensApprox": 200
    }
  ],
  "omittedComponents": [],
  "deferredComponents": [],
  "budgetPlan": {
    "totalPromptTokenTarget": 8000,
    "selectedTokensApprox": 550,
    "projectedOverflow": 0
  },
  "estimatedTokens": {
    "scaffold": 350,
    "skills": 200,
    "tools": 0,
    "history": 0,
    "total": 550
  },
  "riskFlags": [],
  "failOpenReasons": [],
  "planningWarnings": [
    {
      "code": "active_id_unknown",
      "message": "activeSkillIds contains 'skill.does-not-exist-in-registry' which is not present in componentsById"
    }
  ]
}
