{
  "schemaVersion": "v0",
  "promptFamily": "general_default",
  "selectedComponents": [
    {
      "componentId": "scaffold.system-rules",
      "action": "include",
      "path": "required_match",
      "reason": "omissionPolicy: never — always included; requiredWhen: * matched",
      "tokensApprox": 350
    },
    {
      "componentId": "skill.general-assistant",
      "action": "include",
      "path": "default_include",
      "reason": "promptFamily general_default: no safeToOmitWhen matched; defaultAction: include",
      "tokensApprox": 200
    },
    {
      "componentId": "skill.context-summary",
      "action": "include",
      "path": "default_include",
      "reason": "promptFamily general_default: no safeToOmitWhen matched; defaultAction: include",
      "tokensApprox": 150
    }
  ],
  "omittedComponents": [],
  "deferredComponents": [],
  "budgetPlan": {
    "totalPromptTokenTarget": 8000,
    "selectedTokensApprox": 700,
    "projectedOverflow": 0
  },
  "estimatedTokens": {
    "scaffold": 350,
    "skills": 350,
    "tools": 0,
    "history": 0,
    "total": 700
  },
  "riskFlags": [],
  "failOpenReasons": [],
  "planningWarnings": []
}
