{
  "schemaVersion": "v0",
  "promptFamily": "general_default",
  "selectedComponents": [
    {
      "componentId": "scaffold.system-rules",
      "action": "include",
      "path": "required_match",
      "reason": "multiple include decisions merged: requiredWhen=[\"*\"] match + userConstraints.alwaysInclude (multiple_include_merged)",
      "tokensApprox": 350
    },
    {
      "componentId": "skill.general-assistant",
      "action": "include",
      "path": "default_include",
      "reason": "defaultAction: include; safeToOmitWhen does not match general_default",
      "tokensApprox": 200
    }
  ],
  "omittedComponents": [],
  "deferredComponents": [],
  "budgetPlan": {
    "totalPromptTokenTarget": 8000,
    "selectedTokensApprox": 550,
    "projectedOverflow": 0
  },
  "estimatedTokens": {
    "total": 550,
    "scaffold": 350,
    "skills": 200
  },
  "riskFlags": [],
  "failOpenReasons": [],
  "planningWarnings": []
}
